[
  {
    "year": 2025,
    "position": 1,
    "raceNumber": 53,
    "runnerName": "Tom Spearman",
    "club": "OUSC",
    "category": "MSenior",
    "categoryPosition": 1,
    "genderPosition": 1,
    "recordedGenderCategory": "Male",
    "finishTime": "00:33:25"
  },
  {
    "year": 2025,
    "position": 2,
    "raceNumber": 93,
    "runnerName": "Rhys Goodrick",
    "club": "VEGAN RUNNERS UK",
    "category": "MSenior",
    "categoryPosition": 2,
    "genderPosition": 2,
    "recordedGenderCategory": "Male",
    "finishTime": "00:34:34"
  },
  {
    "year": 2025,
    "position": 3,
    "raceNumber": 22,
    "runnerName": "Jonathan Ford",
    "club": "MYNYDD DU",
    "category": "MSenior",
    "categoryPosition": 3,
    "genderPosition": 3,
    "recordedGenderCategory": "Male",
    "finishTime": "00:35:54"
  },
  {
    "year": 2025,
    "position": 4,
    "raceNumber": 25,
    "runnerName": "Wyndham Turner",
    "club": "MYNYDD DU",
    "category": "MSenior",
    "categoryPosition": 4,
    "genderPosition": 4,
    "recordedGenderCategory": "Male",
    "finishTime": "00:36:07"
  },
  {
    "year": 2025,
    "position": 5,
    "raceNumber": 79,
    "runnerName": "Wilf Evans",
    "club": "CDF RUNNERS",
    "category": "MSenior",
    "categoryPosition": 5,
    "genderPosition": 5,
    "recordedGenderCategory": "Male",
    "finishTime": "00:36:09"
  },
  {
    "year": 2025,
    "position": 6,
    "raceNumber": 55,
    "runnerName": "Will Argo",
    "club": "NONE",
    "category": "MSenior",
    "categoryPosition": 6,
    "genderPosition": 6,
    "recordedGenderCategory": "Male",
    "finishTime": "00:37:53"
  },
  {
    "year": 2025,
    "position": 7,
    "raceNumber": 73,
    "runnerName": "Tom Mollekin",
    "club": "MYNYDD DU",
    "category": "MSenior",
    "categoryPosition": 7,
    "genderPosition": 7,
    "recordedGenderCategory": "Male",
    "finishTime": "00:38:13"
  },
  {
    "year": 2025,
    "position": 8,
    "raceNumber": 52,
    "runnerName": "Tommy Lees",
    "club": "OUSC",
    "category": "MSenior",
    "categoryPosition": 8,
    "genderPosition": 8,
    "recordedGenderCategory": "Male",
    "finishTime": "00:38:40"
  },
  {
    "year": 2025,
    "position": 9,
    "raceNumber": 29,
    "runnerName": "Brett Mahoney",
    "club": "MYNYDD DU",
    "category": "MSenior",
    "categoryPosition": 9,
    "genderPosition": 9,
    "recordedGenderCategory": "Male",
    "finishTime": "00:38:54"
  },
  {
    "year": 2025,
    "position": 10,
    "raceNumber": 83,
    "runnerName": "Matt O'Keefe",
    "club": "MYNYDDWYR DE CYMRU (MDC)",
    "category": "M40",
    "categoryPosition": 1,
    "genderPosition": 10,
    "recordedGenderCategory": "Male",
    "finishTime": "00:39:18"
  },
  {
    "year": 2025,
    "position": 11,
    "raceNumber": 61,
    "runnerName": "Paul Murrin",
    "club": "CHEPSTOW HARRIERS",
    "category": "M50",
    "categoryPosition": 1,
    "genderPosition": 11,
    "recordedGenderCategory": "Male",
    "finishTime": "00:39:33"
  },
  {
    "year": 2025,
    "position": 12,
    "raceNumber": 27,
    "runnerName": "Luke Draper",
    "club": "NONE",
    "category": "MSenior",
    "categoryPosition": 10,
    "genderPosition": 12,
    "recordedGenderCategory": "Male",
    "finishTime": "00:40:06"
  },
  {
    "year": 2025,
    "position": 13,
    "raceNumber": 98,
    "runnerName": "Ashley Middlewick",
    "club": "PARC BRYN BACH RUNNING CLUB",
    "category": "MSenior",
    "categoryPosition": 11,
    "genderPosition": 13,
    "recordedGenderCategory": "Male",
    "finishTime": "00:40:11"
  },
  {
    "year": 2025,
    "position": 14,
    "raceNumber": 34,
    "runnerName": "Bethan Logan",
    "club": "MYNYDD DU",
    "category": "FSenior",
    "categoryPosition": 1,
    "genderPosition": 1,
    "recordedGenderCategory": "Female",
    "finishTime": "00:40:21"
  },
  {
    "year": 2025,
    "position": 15,
    "raceNumber": 94,
    "runnerName": "Steven Hepton",
    "club": "MYNYDD DU",
    "category": "M40",
    "categoryPosition": 2,
    "genderPosition": 14,
    "recordedGenderCategory": "Male",
    "finishTime": "00:40:43"
  },
  {
    "year": 2025,
    "position": 16,
    "raceNumber": 71,
    "runnerName": "Luke Donnelly",
    "club": "CHORLTON RUNNERS",
    "category": "MSenior",
    "categoryPosition": 12,
    "genderPosition": 15,
    "recordedGenderCategory": "Male",
    "finishTime": "00:40:46"
  },
  {
    "year": 2025,
    "position": 17,
    "raceNumber": 58,
    "runnerName": "Louie Smith",
    "club": "MYNYDD DU CLIMBING & MOUNTAINEERING CLUB",
    "category": "M40",
    "categoryPosition": 3,
    "genderPosition": 16,
    "recordedGenderCategory": "Male",
    "finishTime": "00:40:47"
  },
  {
    "year": 2025,
    "position": 18,
    "raceNumber": 91,
    "runnerName": "Billy Jackson",
    "club": "MYNYDD DU",
    "category": "MSenior",
    "categoryPosition": 13,
    "genderPosition": 17,
    "recordedGenderCategory": "Male",
    "finishTime": "00:40:53"
  },
  {
    "year": 2025,
    "position": 19,
    "raceNumber": 81,
    "runnerName": "Ian Whistance",
    "club": "MYNYDD DU",
    "category": "M50",
    "categoryPosition": 2,
    "genderPosition": 18,
    "recordedGenderCategory": "Male",
    "finishTime": "00:41:01"
  },
  {
    "year": 2025,
    "position": 20,
    "raceNumber": 56,
    "runnerName": "Phil Decker",
    "club": "NONE",
    "category": "MSenior",
    "categoryPosition": 14,
    "genderPosition": 19,
    "recordedGenderCategory": "Male",
    "finishTime": "00:41:06"
  },
  {
    "year": 2025,
    "position": 21,
    "raceNumber": 92,
    "runnerName": "Mike Fawcett",
    "club": "ROYAL NAVY ATHLETIC CLUB",
    "category": "M50",
    "categoryPosition": 3,
    "genderPosition": 20,
    "recordedGenderCategory": "Male",
    "finishTime": "00:42:13"
  },
  {
    "year": 2025,
    "position": 22,
    "raceNumber": 6,
    "runnerName": "Wes Sheldon",
    "club": "MYNYDD DU",
    "category": "M40",
    "categoryPosition": 4,
    "genderPosition": 21,
    "recordedGenderCategory": "Male",
    "finishTime": "00:42:15"
  },
  {
    "year": 2025,
    "position": 23,
    "raceNumber": 77,
    "runnerName": "Tom Stead",
    "club": "CDF RUNNERS",
    "category": "MSenior",
    "categoryPosition": 15,
    "genderPosition": 22,
    "recordedGenderCategory": "Male",
    "finishTime": "00:42:31"
  },
  {
    "year": 2025,
    "position": 24,
    "raceNumber": 46,
    "runnerName": "Ceri Merwood",
    "club": "CDF RUNNERS",
    "category": "FSenior",
    "categoryPosition": 2,
    "genderPosition": 2,
    "recordedGenderCategory": "Female",
    "finishTime": "00:42:39"
  },
  {
    "year": 2025,
    "position": 25,
    "raceNumber": 41,
    "runnerName": "Dominic McLoughlin",
    "club": "OUSC",
    "category": "MSenior",
    "categoryPosition": 16,
    "genderPosition": 23,
    "recordedGenderCategory": "Male",
    "finishTime": "00:42:52"
  },
  {
    "year": 2025,
    "position": 26,
    "raceNumber": 89,
    "runnerName": "Simon Daniel",
    "club": "BRISTOL UP & RUNNERS",
    "category": "M50",
    "categoryPosition": 4,
    "genderPosition": 24,
    "recordedGenderCategory": "Male",
    "finishTime": "00:43:19"
  },
  {
    "year": 2025,
    "position": 27,
    "raceNumber": 62,
    "runnerName": "Matt Farrer",
    "club": "MYNYDD DU",
    "category": "M40",
    "categoryPosition": 5,
    "genderPosition": 25,
    "recordedGenderCategory": "Male",
    "finishTime": "00:43:20"
  },
  {
    "year": 2025,
    "position": 28,
    "raceNumber": 17,
    "runnerName": "Rhian Probert",
    "club": "MYNYDD DU",
    "category": "F50",
    "categoryPosition": 1,
    "genderPosition": 3,
    "recordedGenderCategory": "Female",
    "finishTime": "00:43:31"
  },
  {
    "year": 2025,
    "position": 29,
    "raceNumber": 20,
    "runnerName": "Tom Turner",
    "club": "MYNYDD DU",
    "category": "M40",
    "categoryPosition": 6,
    "genderPosition": 26,
    "recordedGenderCategory": "Male",
    "finishTime": "00:43:52"
  },
  {
    "year": 2025,
    "position": 30,
    "raceNumber": 65,
    "runnerName": "Tim Lages",
    "club": "MYNYDD DU",
    "category": "MSenior",
    "categoryPosition": 17,
    "genderPosition": 27,
    "recordedGenderCategory": "Male",
    "finishTime": "00:44:07"
  },
  {
    "year": 2025,
    "position": 31,
    "raceNumber": 74,
    "runnerName": "Briony Latter",
    "club": "MYNYDDWYR DE CYMRU (MDC)",
    "category": "FSenior",
    "categoryPosition": 3,
    "genderPosition": 4,
    "recordedGenderCategory": "Female",
    "finishTime": "00:44:08"
  },
  {
    "year": 2025,
    "position": 32,
    "raceNumber": 13,
    "runnerName": "Dale Meek",
    "club": "MYNYDD DU",
    "category": "MSenior",
    "categoryPosition": 18,
    "genderPosition": 28,
    "recordedGenderCategory": "Male",
    "finishTime": "00:44:10"
  },
  {
    "year": 2025,
    "position": 33,
    "raceNumber": 80,
    "runnerName": "Martin Webb",
    "club": "MYNYDD DU",
    "category": "M60",
    "categoryPosition": 1,
    "genderPosition": 29,
    "recordedGenderCategory": "Male",
    "finishTime": "00:44:24"
  },
  {
    "year": 2025,
    "position": 34,
    "raceNumber": 78,
    "runnerName": "Rhydian Davies",
    "club": "CDF RUNNERS",
    "category": "MSenior",
    "categoryPosition": 19,
    "genderPosition": 30,
    "recordedGenderCategory": "Male",
    "finishTime": "00:44:49"
  },
  {
    "year": 2025,
    "position": 35,
    "raceNumber": 28,
    "runnerName": "Chris Medcalf",
    "club": "SAN DOMENICO RC",
    "category": "M50",
    "categoryPosition": 5,
    "genderPosition": 31,
    "recordedGenderCategory": "Male",
    "finishTime": "00:45:17"
  },
  {
    "year": 2025,
    "position": 36,
    "raceNumber": 50,
    "runnerName": "Peter Sowerby",
    "club": "BRECON AC",
    "category": "M60",
    "categoryPosition": 2,
    "genderPosition": 32,
    "recordedGenderCategory": "Male",
    "finishTime": "00:45:18"
  },
  {
    "year": 2025,
    "position": 37,